成都华微：公司发布4通道12位16G高速高精度射频直采ADC芯片,【成都华微：公司发布4通道12位16G高速高精度射频直采ADC芯片】《科创板日报》10日讯，成都华微公告，公司研发的多通道高速高精度射频直采ADC（模数转换器）及配套时钟芯片于近日成功发布。公司研发的HWD12B16GA4型射频直采ADC是一款4通道、12位16GSPS高速高精度射频直采A/D转换器，全流程自主安全，标志着公司在高速高精度数据转换器芯片领域取得了重大突破，其超高性能和集成度为国内独家，可比肩国际先进水平。市场推广方面，该芯片及配套时钟芯片产品是模拟与数字系统接口的关键部件，可广泛应用于雷达与电子对抗、6G无线通信、光通信、高端医疗设备、高端仪器仪表、无人机等领域，是未来应用前景广阔的核心元器件。,2025-06-10 15:36
财联社6月10日电，截至目前，南向资金净买入额达70亿港元。,财联社6月10日电，截至目前，南向资金净买入额达70亿港元。,2025-06-10 15:31
外交部：持续优化营商环境 为外企提供更多政策红利实现多方共赢,"【外交部：持续优化营商环境 为外企提供更多政策红利实现多方共赢】财联社6月10日电，外交部发言人林剑主持例行记者会。有记者提问，我们注意到，近期不少外资企业持续投资中国。中国丹麦商会、德国商会等表示，欧洲企业对持续投资中国很有动力，人工智能、数字孪生、无人驾驶等新技术都是可以开展合作的蓝海。中国美国商会最新调查显示，绝大多数美企没有撤离中国市场的计划。很多外资企业也开始加大本地化研发创新。发言人对此有何评论?

林剑表示，越来越多的外资企业加码中国，体现出外界看重中国高质量发展的稳定性和高水平对外开放的确定性，也彰显了中国新质生产力与科技创新生态的澎湃动能。林剑介绍，我们加快推进制度型开放，推出了《2025年稳外资行动方案》，修订扩大《鼓励外商投资产业目录》，将高端制造、数字经济等前沿领域纳入政策红利圈。今年前5个月有进出口实绩的外企数量超过7.3万家，为5年来同期最高。同时中国持续取得的创新突破、市场对新产业新业态的巨大需求、以及完备的产供链体系、丰富的人才资源，成熟创新生态等独特优势，驱动外企加速投资新质生产力，深嵌中国创新链，“在中国研发、向世界输出”成为热潮，形成了市场、企业和资源要素的良性循环。“从制造高地到创新引擎，中国的发展始终是世界的机遇。我们将持续优化营商环境，为外企提供更多政策红利，欢迎更多的外企立足中国，放眼全球，在新质生产力发展的浪潮中，实现双向奔赴，多方共赢。”林剑说。",2025-06-10 15:30
“并购六条”以来深圳上市公司公布重组预案215笔,【“并购六条”以来深圳上市公司公布重组预案215笔】财联社6月10日电，据深圳证监局消息，随着系列促进并购重组政策措施的出台，深圳上市公司并购重组市场活跃度持续提升，特别是通过并购重组实现向新质生产力发展转型的趋势日益显现。“并购六条”发布以来，深圳上市公司公布并购重组预案215笔，160笔重组事项披露交易金额，合计超过450亿元。（财联社记者 王晨）,2025-06-10 15:30
财联社6月10日电，英国富时100指数突破3月份以来的收盘纪录高点。,财联社6月10日电，英国富时100指数突破3月份以来的收盘纪录高点。,2025-06-10 15:26
DRAM成品现货普遍续涨 低容量eMMC货紧价扬加速相关应用容量升级,【DRAM成品现货普遍续涨 低容量eMMC货紧价扬加速相关应用容量升级】《科创板日报》10日讯，现货旧制程DRAM资源供应缺货涨价延续，存储厂商针对渠道内存条、行业内存条及LPDDR4X等产品现货价格坚定持报涨态度。近日受部分渠道资源价格暴涨影响，渠道DDR4内存条涨势最为强劲，部分产品短短两周价格累计涨幅超30%。低容量eMMC价格不仅较去年年底呈翻倍式增长，16GB/32GB/64GB eMMC已基本同价，随着MLC NAND供应越来越少，未来将加速TV/安防/POS机等应用终端存储容量进一步升级。,2025-06-10 15:24
中坚科技：与草坪相关的主要产品包括自动割草机器人等,【中坚科技：与草坪相关的主要产品包括自动割草机器人等】财联社6月10日电，中坚科技在互动平台表示，公司产品主要应用于园林绿化修剪养护，与草坪相关的主要产品是手推式割草机、坐骑式割草车和自动割草机器人等。,2025-06-10 15:18
俄罗斯萨哈共和国一架飞机失联 机上载有5人,【俄罗斯萨哈共和国一架飞机失联 机上载有5人】财联社6月10日电，俄罗斯联邦萨哈（雅库特）共和国一架飞机当地时间10日失联，机上载有5人。据紧急服务部门10日通报，涉事飞机为一架安-2运输机，事发时在萨哈共和国的托姆蓬斯基区执行森林巡查任务。俄联邦航空运输署已派出搜救飞机，一架米-8直升机也参与搜寻行动。据悉，失联的安-2飞机上除2名机组人员外，还载有3名森林防护监测专家。,2025-06-10 15:17
6月10日涨停分析,【6月10日涨停分析】今日共45股涨停，连板股总数13只，30股封板未遂，封板率为60%（不含ST股、退市股）。焦点股方面，足球概念持续火爆，共创草坪晋级7连板，永悦科技反包涨停走出7天5板，易明医药继续一字涨停收获5连板。,2025-06-10 15:17
国债期货收盘全线收涨,【国债期货收盘全线收涨】财联社6月10日电，国债期货收盘全线收涨，30年期主力合约涨0.07%，10年期主力合约涨0.01%，5年期主力合约涨0.01%，2年期主力合约涨0.00%。,2025-06-10 15:16
Siri的AI升级功能短期内不会推出,【Siri的AI升级功能短期内不会推出】《科创板日报》10日讯，苹果在北京时间今日凌晨举行的WWDC上宣布了Apple Intelligence的一系列新功能，并向开发者开放苹果的基础模型。苹果此次推出全新的软件界面设计“液态玻璃”，应用于iPhone等旗下多种硬件设备的操作系统，iPhone迎来2013年来首次OS设计更新。同时，苹果简化了软件版本命名方式，改以年份命名。另外，苹果的软件工程高级副总裁Craig Federighi承认，Siri的AI升级功能短期内不会推出。,2025-06-10 15:15
日本称两艘中国军舰首次同时出现在太平洋海域活动 外交部回应,【日本称两艘中国军舰首次同时出现在太平洋海域活动 外交部回应】财联社6月10日电，在6月10日外交部例行记者会上，有记者提问称，日本防相称，今天两艘中国军舰首次同时出现在太平洋海域活动。发言人能否介绍更多细节？对此，发言人林剑表示，我昨天已经回答了相关的问题，我要重申，中国军舰在有关海域的活动完全符合国际法和国际惯例。中国一贯奉行防御性的国防政策，希望日方客观理性看待。,2025-06-10 15:14
《科创板日报》10日讯，英伟达的下一代AI GPU Vera和CPU Rubin开发过程较原先顺利，预计本月完成流片，最快9月向客户出样，2026年初量产。,《科创板日报》10日讯，英伟达的下一代AI GPU Vera和CPU Rubin开发过程较原先顺利，预计本月完成流片，最快9月向客户出样，2026年初量产。,2025-06-10 15:14
泽连斯基：基辅遭遇冲突爆发以来最猛烈空袭,【泽连斯基：基辅遭遇冲突爆发以来最猛烈空袭】财联社6月10日电，乌克兰总统泽连斯基当地时间6月10日在其官方社交平台发文称，当天乌克兰首都基辅遭遇了冲突爆发以来最猛烈的空袭之一，此外敖德萨市、第聂伯罗彼得罗夫斯克州和切尔尼戈夫州也遭到了袭击。此次袭击，俄军共动用315架无人机及7枚导弹。民宅与城市基础设施受损，敖德萨市一家妇产医院也在打击目标中。此次袭击已造成13人受伤，还有人丧生。俄方对此暂无回应。,2025-06-10 15:13
2025年侵权假冒伪劣商品全国统一销毁行动举行,【2025年侵权假冒伪劣商品全国统一销毁行动举行】财联社6月10日电，国家质量强国建设协调推进领导小组办公室与市场监管总局6月10日联合组织开展2025年侵权假冒伪劣商品全国统一销毁行动。主会场设在湖南省长沙市，25个省（区、市）设分会场，主、分会场通过视频连线同步开展销毁工作。此次行动聚焦民生和安全领域，全国共销毁侵权假冒伪劣食品药品、服装鞋帽、烟酒、化妆品、盗版出版物、燃气灶具、消防产品等200多个品种，总量达3683吨、货值4.32亿元。所有销毁均采取绿色环保、无害化方式进行。,2025-06-10 15:10
A股分红潮来袭，恒生红利低波ETF（159545）、红利低波动ETF（563020）规模均创新高,"【A股分红潮来袭，恒生红利低波ETF（159545）、红利低波动ETF（563020）规模均创新高】
截至14:50，中证红利低波动指数上涨0.1%，恒生港股通高股息低波动指数上涨0.6%，相关产品持续获资金净流入。Wind数据显示，截至昨日，恒生红利低波ETF（159545）、红利低波动ETF（563020）均连续“吸金”超10个交易日，规模均创下新高。
近期A股市场呈现出积极的分红态势，上市公司密集发布2024年年度权益分派实施公告。截至6月9日收盘，已有超过1500家上市公司完成了2024年度分红方案的实施。中信建投证券指出，从历史规律看，受年报披露及派息制度约束，A股5-7月进入分红高峰期，6月分红规模尤为突出，高股息板块成为资金配置焦点。
恒生红利低波ETF（159545）、红利低波动ETF（563020）的管理费率加托管费率均为0.2%/年，可助力投资者低成本布局红利资产。",2025-06-10 15:05
重磅合并落地，信创ETF易方达（159540）连续10个交易日“吸金”，规模创新高,"【重磅合并落地，信创ETF易方达（159540）连续10个交易日“吸金”，规模创新高】
国产算力“航母”启航在即。昨日晚间，海光信息和中科曙光双双公告披露换股吸收合并预案，海光信息拟以0.5525:1的换股比例吸收合并中科曙光，并向特定投资者发行股份募集配套资金，两家公司股票已于今日复牌。
天风证券认为，信创板块收入端稳健复苏，结构性亮点突出，国产算力与信创板块受益于政策支持自主可控与技术迭代，景气度有望持续上行。
国证信息技术创新主题指数由业务涉及基础硬件、基础软件、应用软件、信息安全等信息技术创新主题的股票组成，海光信息、中科曙光为前两大成份股，合计权重13.6%，高于其他信创主题指数。跟踪该指数的信创ETF易方达（159540，联接基金：020403/020404）连续10个交易日获资金加仓，最新规模超7亿元，创历史新高。",2025-06-10 15:05
财联社6月10日电，欧元兑英镑上涨0.3%至0.8455，为5月21日以来的最高水平。,财联社6月10日电，欧元兑英镑上涨0.3%至0.8455，为5月21日以来的最高水平。,2025-06-10 15:03
科创板收评：创新药概念股表现活跃 浩欧博20CM涨停,【科创板收评：创新药概念股表现活跃 浩欧博20CM涨停】《科创板日报》10日讯，今日，科创50指数收跌1.47%。盘面上，创新药概念股表现活跃，艾迪药业、君实生物涨超9%，毕得医药涨超7%，科兴制药涨超6%。CPO、PCB、半导体等AI硬件板块普跌，迈信林跌超9%，迅捷兴跌超8%，翱捷科技、乐鑫科技跌超6%，天德钰跌超5%。个股表现上，医疗器械股浩欧博20CM涨停。,2025-06-10 15:03
欧洲主要股指开盘涨跌互现,【欧洲主要股指开盘涨跌互现】财联社6月10日电，欧洲主要股指开盘涨跌互现，德国DAX30指数平开，报24172.64点；英国富时100指数涨0.20%，报8849.78点；欧洲斯托克50指数跌0.10%，报5416.05点；法国CAC40指数涨0.01%，报7792.41点。,2025-06-10 15:02
国内商品期货收盘涨跌不一 铝合金涨超4%,【国内商品期货收盘涨跌不一 铝合金涨超4%】财联社6月10日电，国内商品期货收盘涨跌不一，铝合金涨超4%，苯乙烯涨超2%，红枣、豆一、20号胶、原油、生猪涨超1%，跌幅方面，不锈钢、沪锌、尿素、沪镍跌超1%。,2025-06-10 15:02
收评：创业板指放量跌超1% 全市场超4000只个股下跌,【收评：创业板指放量跌超1% 全市场超4000只个股下跌】财联社6月10日电，市场午后快速走低，创业板指领跌。沪深两市全天成交额1.42万亿，较上个交易日放量1290亿。盘面上，市场热点较为杂乱，个股跌多涨少，全市场超4000只个股下跌。从板块来看，港口航运股集体大涨，南京港等涨停。创新药概念股维持强势，哈三联等涨停。稀土永磁概念股逆势走强，中科磁业20CM涨停。下跌方面，军工股展开调整，捷强装备跌超10%。板块方面，港口航运、美容护理、创新药、稀土永磁等板块涨幅居前，华为昇腾、军工、半导体、软件开发等板块跌幅居前。截至收盘，沪指跌0.44%，深成指跌0.86%，创业板指跌1.17%。,2025-06-10 15:02
农发行两期金融债已结束招标 2年期品种25农发清发12(增发7)中标收益率1.5026%,"【农发行两期金融债已结束招标 2年期品种25农发清发12(增发7)中标收益率1.5026%】财联社6月10日电，农发行两期金融债已结束招标,其中：2Y品种25农发清发09(增发5)中标收益率1.7003%，全场倍数2.84，边际倍数8.75；2Y期品种25农发清发12(增发7)中标收益率1.5026%，全场倍数5.04，边际倍数2.81。",2025-06-10 15:02
美企对特定电子眼镜及其组件等提起337调查申请 多家中企为列名被告,"【美企对特定电子眼镜及其组件等提起337调查申请 多家中企为列名被告】财联社6月10日电，据中国贸易救济信息网，6月6日，美国IngenioSpec, LLC, LLC根据《美国1930年关税法》第337节规定向美国际贸易委员会提出申请，主张对美出口、在美进口及销售的特定电子眼镜及其组件和相关充电设备(II)（Certain Electronic Eyewear Products, Components Thereof, and Related Charging Apparatuses (II)）违反了美国337条款。

新加坡Brilliant Labs Limited of Singapore、中国广东SZ DJI Technology Co., Ltd. of China深圳市大疆创新科技有限公司、中国广东Even Realities Ltd. of China深圳市逸文科技有限公司、德国Even Realities GmbH of Germany、新加坡Halliday Global of Singapore、新加坡Halliday Holdings Pte. Ltd. of Singapore、中国Cosonic Intelligent Technologies Co., Ltd. of China、中国广东Shenzhen Yingmu Technology Co., Ltd. of China深圳英牧科技有限公司、中国四川Sichuan INMO Technology Co., Ltd. of China四川影目科技有限公司、中国MyW Technology Co., Ltd. of China、中国广东Shenzhen Langzhiyin Electronic Co., Ltd., of China深圳市浪之音电子有限公司、中国浙江Hangzhou Guangli Technology Co., Ltd. of China杭州光粒科技有限公司、中国山东Lexiang Technology Co., Ltd. of China乐相科技有限公司为列名被告。",2025-06-10 15:01
商务部：对原产于欧盟的进口相关猪肉及猪副产品进行反倾销立案调查期限延长至2025年12月16日,【商务部：对原产于欧盟的进口相关猪肉及猪副产品进行反倾销立案调查期限延长至2025年12月16日】财联社6月10日电，商务部发布公告称，根据《中华人民共和国反倾销条例》的规定，2024年6月17日，商务部发布2024年第23号公告，决定对原产于欧盟的进口相关猪肉及猪副产品进行反倾销立案调查。鉴于本案情况复杂，根据《中华人民共和国反倾销条例》第二十六条的规定，商务部决定将本案的调查期限延长至2025年12月16日。,2025-06-10 15:01
稳定币《天才法案》本周将“闯关”美国参议院,【稳定币《天才法案》本周将“闯关”美国参议院】财联社6月10日电，美国国会参议院多数党领袖、共和党人约翰·图恩9日表示，打算在本周内表决通过《指导与建立美国稳定币国家创新法案》（简称《天才法案》）。据美国《政治报》网站报道，图恩当天说，参议院共和党人正尝试就如何修订法案达成共识，目标是让法案本周获得通过。图恩当天提请结束围绕法案的辩论，后续程序性投票最早于11日举行。按美联社说法，截至目前已有多达16名参议院民主党人愿支持《天才法案》。即便法案需要修订内容，仍有望在本月内成功“闯关”参议院。参议院共设100个议席，共和党人现掌握53席。《天才法案》将为“锚定”美元的稳定币制定监管框架，被普遍视作有利强化对消费者保护，并增进加密货币行业合法性。稳定币属于加密货币，是一种旨在与某些资产（通常是货币）维持相对稳定价值的虚拟资产。,2025-06-10 14:57
财联社6月10日电，马斯克表示，SpaceX今年的收入将达到155亿美元。,财联社6月10日电，马斯克表示，SpaceX今年的收入将达到155亿美元。,2025-06-10 14:57
越南电动车商VinFast一季度交付量同比大增296% 净亏损近7.12亿美元,【越南电动车商VinFast一季度交付量同比大增296% 净亏损近7.12亿美元】财联社6月10日电，越南电动车商VinFast当地时间6月10日公布一季度经营业绩，共交付36330辆电动汽车，同比增长296%，超过去年上半年交付总量。一季度，VinFast总营收达16306.4万亿越南盾（约合6.57亿美元），同比增长149.9%；季度净亏损为176938亿越南盾（约合7.12亿美元）。,2025-06-10 14:51
红利低波动ETF（563020）迎年内第二次分红，每10份基金份额派发现金红利0.1元,"【红利低波动ETF（563020）迎年内第二次分红，每10份基金份额派发现金红利0.1元】今日，红利低波动ETF（563020）发布分红公告，将进行今年第2次分红，每10份基金份额分红0.1元，权益登记日为6月11日，除息日为6月12日，现金红利发放日为6月17日。
红利低波动ETF（563020）跟踪的中证红利低波动指数由50只流动性好、连续分红、红利支付率适中、每股股息正增长以及股息率高且波动率低的股票组成，反映分红水平高且波动率低的A股上市公司股票的整体表现，银行、建筑装饰、交通运输行业合计占比近七成，目前指数股息率达5.6%。
易方达基金旗下“红利全家桶”涵盖了红利ETF易方达（515180）、红利低波动ETF（563020）、恒生红利低波ETF（159545）、红利价值ETF（563700）等产品，管理费率均采用ETF中最低一档的0.15%/年，可助力投资者低成本布局高股息资产。",2025-06-10 14:48
财联社6月10日电，META的扎克伯格据悉正在创建新的AI“超级智能”团队，在为新团队亲自招募约50名专家。,财联社6月10日电，META的扎克伯格据悉正在创建新的AI“超级智能”团队，在为新团队亲自招募约50名专家。,2025-06-10 14:44
短剧概念尾盘异动 慈文传媒直线涨停,【短剧概念尾盘异动 慈文传媒直线涨停】财联社6月10日电，短剧概念尾盘异动拉升，慈文传媒直线涨停，中文在线、果麦文化涨超10%，幸福蓝海、华策影视、欢瑞世纪等涨幅靠前。消息面上，根据DataEye和中国网络视听协会，2024年中国微短剧的市场规模达到504亿元，网民使用率近60%。预期2025年国内短剧市场将继续增长36%至686亿元，增量主要来自免费短剧。,2025-06-10 14:43
财联社6月10日电，马斯克在社交平台X上表示，希望很快星链能进入泰国。,财联社6月10日电，马斯克在社交平台X上表示，希望很快星链能进入泰国。,2025-06-10 14:42
日本政府将追加投放20万吨储备米,【日本政府将追加投放20万吨储备米】财联社6月10日电，日本农相小泉进次郎6月10日宣布，将以“随意合同”方式追加投放20万吨政府储备米，其中2021年产大米为10万吨，2020年产为10万吨。不仅中小超市，一度停止征集的米粮店和大型超市等零售商也被作为对象。,2025-06-10 14:37
财联社6月10日电，英镑兑美元跌幅扩大，下跌0.3%至1.3512。,财联社6月10日电，英镑兑美元跌幅扩大，下跌0.3%至1.3512。,2025-06-10 14:36
财联社6月10日电，英国利率期货定价2025年剩余时间内英国央行将降息46个基点，劳动力市场数据公布前的预期为39个基点。,财联社6月10日电，英国利率期货定价2025年剩余时间内英国央行将降息46个基点，劳动力市场数据公布前的预期为39个基点。,2025-06-10 14:36
华阳新材料科技集团有限公司原党委书记、董事长翟红接受纪律审查和监察调查,【华阳新材料科技集团有限公司原党委书记、董事长翟红接受纪律审查和监察调查】财联社6月10日电，山西省纪委监委10日通报，华阳新材料科技集团有限公司原党委书记、董事长翟红涉嫌严重违纪违法，目前正接受山西省纪委监委纪律审查和监察调查。,2025-06-10 14:34
财联社6月10日电，日经225指数收盘涨0.32%，报38211点。韩国KOSPI指数收涨0.56%。,财联社6月10日电，日经225指数收盘涨0.32%，报38211点。韩国KOSPI指数收涨0.56%。,2025-06-10 14:31
2025赛季“粤超”计划于7月至10月期间举行,【2025赛季“粤超”计划于7月至10月期间举行】财联社6月10日电，据大湾区之声，近日，广东省足协官网发布通知，2025赛季“粤超”计划于7月至10月期间举行。今年的“粤超”将有16支球队参赛，目前处于预报名阶段。据悉，比赛日期为2025年7月至9月，第一阶段地点为省内各赛会制地点，第二阶段为各晋级参赛俱乐部主场。值得注意的是，“粤超”允许来自港澳台地区的运动员报名参赛，每队可注册3名港澳台球员，每场可同时上场2人。,2025-06-10 14:29
主力资金监控：计算机板块净流出超92亿,【主力资金监控：计算机板块净流出超92亿】财联社6月10日电，财联社星矿数据显示，今日主力资金净流入航运港口、银行、交通运输等板块，净流出计算机、电子、机械设备等板块，其中计算机板块净流出超92亿元。个股方面，乐山电力涨停，主力资金净买入6.50亿元位居首位，汇洲智能、工商银行、龙蟠科技主力资金净流入居前；海光信息遭净卖出超9亿元位居首位，东方财富、浪潮信息、中际旭创主力资金净流出额居前。,2025-06-10 14:23
财联社6月10日电，英镑兑美元短线跌逾10点报1.3528。,财联社6月10日电，英镑兑美元短线跌逾10点报1.3528。,2025-06-10 14:10
14点快评：午后市场热点聚焦稀土、农业,【14点快评：午后市场热点聚焦稀土、农业】市场午后快速跳水，创业板指领跌。成交量方面，午后第一个小时两市放量1637亿。板块方面，午后市场热点集中在稀土、农业等反制方向。短线方面，情绪逆势活跃，昨日连板股仅1只个股下跌，涨停晋级率接近50%。此外，午后两市炸板个股明显增多，炸板率超40%。,2025-06-10 14:10
沪深两市成交额突破1.2万亿 预计全天成交近1.5万亿,【沪深两市成交额突破1.2万亿 预计全天成交近1.5万亿】财联社6月10日电，据财联社盯盘数据显示，沪深两市成交额突破1.2万亿，较昨日此时放量超1300亿，预计全天成交金额近1.5万亿。,2025-06-10 14:09
韩国法院延期审理总统李在明涉地产开发案,【韩国法院延期审理总统李在明涉地产开发案】财联社6月10日电，据总台记者当地时间6月10日消息，韩国法院宣布总统李在明涉地产开发案延期审理。,2025-06-10 14:06
财联社6月10日电，现代汽车告诉投资者，预计短期内不会出现稀土引发的电动和混合动力汽车生产中断。,财联社6月10日电，现代汽车告诉投资者，预计短期内不会出现稀土引发的电动和混合动力汽车生产中断。,2025-06-10 14:05
财联社6月10日电，英国2-4月ILO失业率4.6%，预期4.6%。,财联社6月10日电，英国2-4月ILO失业率4.6%，预期4.6%。,2025-06-10 14:01
