热带低压将于6月10日在南海中东部海面生成 船只做好避风准备,【热带低压将于6月10日在南海中东部海面生成 船只做好避风准备】财联社6月9日电，记者6月9日上午从海南省气象台了解到，热带低压将于6月10日在南海中东部海面生成，随后西北行趋向海南岛东部到广东西部一带沿海，可能于11日加强为今年第1号台风，最强可达强热带风暴级到台风级（10～12级，25～33米/秒）。受其影响，南海中部、北部海域风力将逐渐增大，部分海区有9～11级阵风；西沙、中沙和南沙群岛各岛礁以及海南岛大部地区有暴雨或大暴雨。海南省气象部门提醒，南海热带低压在南海中东部海面生成后将逐渐靠近海南岛东部至广东西部一带近海，请海上作业平台及过往船只做好避风准备，各有关部门持续关注海南省气象局最新气象预报信息。,2025-06-09 12:07
巴西寻求最早今年发行熊猫债券,【巴西寻求最早今年发行熊猫债券】财联社6月9日电，巴西财政部副部长达里奥·杜里甘（Dario Durigan）表示，巴西计划最早今年在中国市场发行首笔主权债务。杜里甘称，巴西计划今年在欧洲发行新的美元可持续债券，并在中国发行熊猫债券。杜里甘称，欧盟希望与巴西进行谈判，以扩大双边贸易，无论是在交易的条件方面，还是允许巴西在欧洲发行债券方面，“同样的事情也可能发生在中国”。,2025-06-09 12:04
加州州长纽森说将起诉特朗普,【加州州长纽森说将起诉特朗普】财联社6月9日电，美国加利福尼亚州州长纽森8日晚在社交媒体上说，美国总统特朗普不征求州长意见就调遣加州国民警卫队是“非法和不道德的”，加州将把特朗普告上法庭。,2025-06-09 12:03
四川省宜宾市政府党组成员、副市长兰宏彬接受纪律审查和监察调查,【四川省宜宾市政府党组成员、副市长兰宏彬接受纪律审查和监察调查】财联社6月9日电，据四川省纪委监委消息：四川省宜宾市政府党组成员、副市长兰宏彬涉嫌严重违纪违法，主动投案，目前正接受四川省纪委监委纪律审查和监察调查。,2025-06-09 12:02
"财联社6月9日电，本田中国5月汽车销量为55,108辆，同比下降16.8%。","财联社6月9日电，本田中国5月汽车销量为55,108辆，同比下降16.8%。",2025-06-09 11:59
6月9日午间涨停分析,【6月9日午间涨停分析】财联社6月9日电，今日午盘全市场共53股涨停，连板股总数11只，22股封板未遂，封板率为71%（不含ST股、退市股）。焦点股方面，共创草坪晋级6连板，联化科技走出8天6板，创新药概念全线爆发，昂利康5天3板，常山药业、热景生物、诺诚健华、舒泰神等涨超10%。,2025-06-09 11:55
两部门：引导行业紧扣老年人的生理心理特点及服务需求 进行智能养老服务机器人产品的设计开发,【两部门：引导行业紧扣老年人的生理心理特点及服务需求 进行智能养老服务机器人产品的设计开发】财联社6月9日电，工信部、民政部发布开展智能养老服务机器人结对攻关与场景应用试点工作的通知，试点期为2025—2027年。通知指出，完善标准及评价体系。鼓励产品研制单位和应用试点单位联合开展智能养老服务机器人标准研究，聚焦场景需求和应用安全研制智能养老服务机器人产品和服务标准规范，聚焦安全性、可靠性、适老化、经济性等研制智能养老服务机器人产品评价标准。引导行业紧扣老年人的生理心理特点及服务需求，进行智能养老服务机器人产品的设计开发，提升产品适老化、智能化和安全可靠水平。,2025-06-09 11:46
国台办：第十七届海峡论坛将于6月中旬在福建举办,【国台办：第十七届海峡论坛将于6月中旬在福建举办】财联社6月9日电，国务院台办发言人朱凤莲6月9日表示，第十七届海峡论坛将于6月中旬在福建举办，15日上午举办论坛大会，集中活动为期一周。论坛主会场设在厦门，福建有关设区市和平潭综合实验区也将举办相关活动。本届论坛坚持“民间性、草根性、广泛性”定位，延续“扩大民间交流、深化融合发展”主题，设置基层交流、青年交流、文化交流、经济交流四大板块。目前论坛各项筹备工作稳步推进，进展顺利。,2025-06-09 11:44
韩国总统李在明与日本首相石破茂通话 讨论双边关系,【韩国总统李在明与日本首相石破茂通话 讨论双边关系】财联社6月9日电，韩国总统发言人称，总统李在明与日本首相石破茂周一早些时候首次通话，讨论持续了25分钟。两国领导人同意在相互尊重、信任和负责任态度的基础上构建更加稳固、成熟的韩日关系。,2025-06-09 11:43
恒生中国企业指数与恒生科技指数迈向技术性牛市,【恒生中国企业指数与恒生科技指数迈向技术性牛市】财联社6月9日电，周一恒生中国企业指数与恒生科技指数双双自4月低点升逾20%，迈向技术性牛市。,2025-06-09 11:41
两部门：居家养老服务机器人产品需完成不少于200户家庭应用验证,【两部门：居家养老服务机器人产品需完成不少于200户家庭应用验证】财联社6月9日电，工信部、民政部发布开展智能养老服务机器人结对攻关与场景应用试点工作的通知，试点期为2025—2027年。通知指出，面向居家、社区、机构三类养老服务形态，围绕失能失智照护、情感陪护、健康促进、智慧环境、日常生活辅助等应用场景，以用户实际场景中的需求痛点问题为导向，针对现有产品或解决方案短板开展研用结对攻关，逐步提升产品的安全性、可靠性、易用性和服务能力。开展场景应用验证。在家庭、社区和养老机构等场景中试点应用，在应用验证过程中完成产品迭代升级，应用验证周期不少于6个月。居家养老服务机器人产品需完成不少于200户家庭应用验证，部署不少于200台套；社区和机构类养老服务机器人产品需完成不少于20个社区或20家养老机构应用验证，部署不少于20台套。,2025-06-09 11:35
午评：创业板指半日涨1.22% 创新药概念股再度大涨,【午评：创业板指半日涨1.22% 创新药概念股再度大涨】财联社6月9日电，市场早盘震荡走高，创业板指领涨。沪深两市半日成交额8230亿，较上个交易日放量764亿。盘面上热点快速轮动，个股涨多跌少，全市场超3600只个股上涨。从板块来看，创新药概念股再度大涨，睿智医药等涨停。固态电池概念股震荡走强，金龙羽等涨停。互联网金融概念股表现活跃，瑞达期货等涨停。板块方面，创新药、稀土永磁、固态电池、互联网金融等板块涨幅居前，黄金、银行、有色金属、港口等板块跌幅居前。截至收盘，沪指涨0.23%，深成指涨0.62%，创业板指涨1.22%。,2025-06-09 11:32
驻日美军基地发生爆炸,【驻日美军基地发生爆炸】财联社6月9日电，据日本广播协会（NHK）报道，今天（6月9日）冲绳驻日美军嘉手纳基地弹药库所在区域发生爆炸，据称有人员受伤。,2025-06-09 11:30
交通运输部：上周监测港口累计完成货物吞吐量25536.7万吨 环比下降7.95%,【交通运输部：上周监测港口累计完成货物吞吐量25536.7万吨 环比下降7.95%】财联社6月9日电，交通运输部消息，根据国务院物流保通保畅工作领导小组办公室监测汇总数据，6月2日—6月8日，全国货运物流有序运行，其中：国家铁路累计运输货物7631万吨，环比下降1.71%；全国高速公路累计货车通行5200.4万辆，环比下降0.01%；监测港口累计完成货物吞吐量25536.7万吨，环比下降7.95%，完成集装箱吞吐量639.1万标箱，环比下降1.93%。,2025-06-09 11:28
海关总署：1至5月累计出口稀土24827吨 同比增长2.3%,【海关总署：1至5月累计出口稀土24827吨 同比增长2.3%】财联社6月9日电，海关总署发布数据显示，中国5月稀土出口5864.6吨；1至5月累计出口24827吨，比上年同期增长2.3%。,2025-06-09 11:23
湖北大数据集团登记成立 注册资本50亿,【湖北大数据集团登记成立 注册资本50亿】财联社6月9日电，天眼查显示，近日，湖北大数据集团有限公司成立，法定代表人为汪小波，注册资本50亿人民币，经营范围含互联网数据服务、大数据服务、数据处理服务、数据处理和存储支持服务、工业互联网数据服务、人工智能应用软件开发、人工智能基础软件开发、人工智能理论与算法软件开发、5G通信技术服务等。股东信息显示，该公司由长江产业投资集团有限公司、湖北交通投资集团有限公司、湖北省人民政府国有资产监督管理委员会、湖北港口集团有限公司等共同持股。据媒体报道，作为省属一级国有企业，该集团由省政府国资委联合6家省属企业共同出资组建，标志着湖北在系统化布局数据要素市场、构建数字经济新引擎方面迈出关键一步。,2025-06-09 11:21
韩国鸡蛋价格创四年来新高,【韩国鸡蛋价格创四年来新高】财联社6月9日电，韩国农村经济研究院8日发表报告说，该国鸡蛋价格在5月达到四年来最高水平，预计上涨趋势将至少持续到8月。韩国媒体援引该机构报告内容报道，韩国30枚装大号鸡蛋平均零售价格5月达到7026韩元（1000韩元约合5.3元人民币），自2021年7月以来首次突破7000韩元。该机构还预测，10枚装大号鸡蛋6月农场交货价格预计与一年前相比涨幅将达12.4%至18.5%，比2020年至2024年的平均价格上涨9.9%至15.8%；7月过后，鸡蛋消费进入淡季，价格较前一个月将有所回落，但预计与去年8月相比，仍会上涨8.2%至14.4%。,2025-06-09 11:20
海关总署：前5个月成品油进口1598万吨 同比减少26.8%,【海关总署：前5个月成品油进口1598万吨 同比减少26.8%】财联社6月9日电，海关总署发布数据显示，前5个月，铁矿砂、原油、煤等主要大宗商品进口价格下跌，机电产品进口值增长。前5个月，我国进口铁矿砂4.86亿吨，减少5.2%，进口均价（下同）每吨707.2元，下跌16.4%；原油 2.3亿吨，增加0.3%，每吨3864.3元，下跌10.6%；煤1.89亿吨，减少7.9%，每吨559元，下跌22.5%；天然气4905.3万吨，减少9.5%，每吨3274元，下跌6.8%；大豆3710.8万吨，减少0.7%，每吨3233.9元，下跌13.9%；成品油1598万吨，减少26.8%，每吨4323.2元，下跌0.1%。此外，进口初级形状的塑料1169.8万吨，减少2.3%，每吨1.06万元，下跌0.8%；未锻轧铜及铜材216.9万吨，减少6.7%，每吨6.94万元，上涨6.6%。同期，进口机电产品2.83万亿元，增长6%。,2025-06-09 11:13
海关总署：前5个月集成电路出口额5264亿元 同比增长18.9%,【海关总署：前5个月集成电路出口额5264亿元 同比增长18.9%】财联社6月9日电，据海关统计，前5个月，我国出口机电产品6.4万亿元，增长9.3%，占我出口总值的60%。其中，自动数据处理设备及其零部件 5752.3亿元，增长3.9%；集成电路5264亿元，增长18.9%；汽车3513.7亿元，增长6.6%。同期，出口劳密产品1.66万亿元，下降1.5%，占15.6%。其中，纺织品4201.4亿元，增长3.7%。出口农产品2960.9亿元，增长4.7%。,2025-06-09 11:11
海关总署：今年前5个月美国为我第三大贸易伙伴 我与美国贸易总值下降8.1%,【海关总署：今年前5个月美国为我第三大贸易伙伴 我与美国贸易总值下降8.1%】财联社6月9日电，海关总署今天（9日）对外公布，今年前5个月，东盟为我第一大贸易伙伴，我与东盟贸易总值为3.02万亿元，增长9.1%，占我外贸总值的16.8%。其中，对东盟出口1.9万亿元，增长13.5%；自东盟进口1.12万亿元，增长2.3%。欧盟为我第二大贸易伙伴，我与欧盟贸易总值为2.3万亿元，增长2.9%，占12.8%。其中，对欧盟出口1.57万亿元，增长7.7%；自欧盟进口7283.3亿元，下降6.1%。美国为我第三大贸易伙伴，我与美国贸易总值为1.72万亿元，下降8.1%，占9.6%。其中，对美国出口1.27万亿元，下降8.7%；自美国进口4475.1亿元，下降6.3%。同期，我国对共建“一带一路”国家合计进出口9.24万亿元，增长4.2%。其中，出口5.34万亿元，增长10.4%；进口3.9万亿元，下降3.2%。,2025-06-09 11:09
财联社6月9日电，韩国警方传唤尹锡悦12日接受调查。,财联社6月9日电，韩国警方传唤尹锡悦12日接受调查。,2025-06-09 11:08
海关总署：今年前5个月中非贸易规模创历史同期新高,【海关总署：今年前5个月中非贸易规模创历史同期新高】财联社6月9日电，海关总署今天（9日）对外公布，今年前5个月，我国对非洲国家进出口9632.1亿元，增长12.4%，占我国进出口总值的5.4%。其中，出口5995.7亿元，增长20.2%；进口3636.4亿元，增长1.6%。,2025-06-09 11:08
实施“人工智能+制造”行动，人工智能ETF（159819）、科创人工智能ETF（588730）聚焦AI产业发展机遇,"【实施“人工智能+制造”行动，人工智能ETF（159819）、科创人工智能ETF（588730）聚焦AI产业发展机遇】
截至10:03，中证人工智能主题指数上涨0.7%，上证科创板人工智能指数上涨0.4%。
工信部近日召开部两化融合工作领导小组会议，审议《工业和信息化部信息化和工业化融合2025年工作要点》。会议要求，实施“人工智能+制造”行动，加快重点行业智能升级，打造智能制造“升级版”；加快建设工业高质量数据集，夯实人工智能工业应用的数据底座；以工业智能体为抓手深化人工智能工业应用，带动工业数据集、工业大模型的创新迭代。
人工智能再获政策加码，聚焦AI产业发展机遇的相关标的受市场关注。中证人工智能主题指数汇聚沪深两市AI产业链各细分环节龙头公司，行业分布相对均衡；上证科创板人工智能指数则聚焦科创板AI龙头公司，基础芯片、AI应用等环节占比较高。市场上有人工智能ETF（159819）、科创人工智能ETF（588730）等产品，可助力投资者布局产业发展机遇。",2025-06-09 11:07
财联社6月9日电，海关总署公布以美元计价的货物贸易数据显示，5月以美元计价进口同比下降3.4%，出口同比增长4.8%。,财联社6月9日电，海关总署公布以美元计价的货物贸易数据显示，5月以美元计价进口同比下降3.4%，出口同比增长4.8%。,2025-06-09 11:06
海关总署：今年前5个月我国出口电动汽车增长19% 工业机器人增长55.4%,【海关总署：今年前5个月我国出口电动汽车增长19% 工业机器人增长55.4%】财联社6月9日电，海关总署今天（9日）对外公布，今年前5个月，我国出口装备制造业产品6.22万亿元，增长9.2%，占我国出口总值的58.3%。其中，出口电动汽车增长19%、工程机械增长10.7%、船舶增长18.9%、工业机器人增长55.4%。前5个月，我国装备制造业产品对整体出口增长的贡献率为73%，其中5月份贡献率高达76.9%，为外贸稳定增长提供了有力支撑。,2025-06-09 11:04
海关总署：今年前5个月我国外资企业进出口5.21万亿元 占我国进出口总值的29%,【海关总署：今年前5个月我国外资企业进出口5.21万亿元 占我国进出口总值的29%】财联社6月9日电，海关总署今天（9日）对外公布，今年前5个月，我国外资企业进出口5.21万亿元，增长2.3%，占我国进出口总值的29%，拉动同期我国整体进出口增长0.7个百分点。其中，5月份外资企业进出口1.11万亿元，增长4%，增速较前4个月加快2.2个百分点。前5个月，我国有进出口实绩的外资企业数量超过7.3万家，为5年来同期最高，月度进出口值连续4个月保持增长。中国坚定不移扩大高水平对外开放，始终是外商理想、安全、有为的投资目的地。,2025-06-09 11:03
海关总署：5月我国出口2.28万亿元 同比增长6.3%,【海关总署：5月我国出口2.28万亿元 同比增长6.3%】财联社6月9日电，海关总署今天（9日）对外公布，今年前5个月，我国货物贸易进出口总值17.94万亿元，同比增长2.5%，延续增长态势。5月份进出口3.81万亿元，增长2.7%。5月当月，我国出口2.28万亿元，增长6.3%。其中，对东盟、欧盟、非洲、中亚五国出口分别增长16.9%、13.7%、35.3%、8.8%。,2025-06-09 11:01
主力资金监控：江淮汽车净买入超8亿,【主力资金监控：江淮汽车净买入超8亿】财联社6月9日电，财联社星矿数据显示，今日早盘主力资金净流入医药、非银金融、国防军工等板块，净流出电新行业、半导体、银行等板块，其中医药板块净流入超24亿元。个股方面，江淮汽车涨停，主力资金净买入8.63亿元位居首位，跨境通、中航沈飞、润欣科技获主力资金净流入居前；比亚迪遭净卖出超8亿元，二六三、紫金矿业、中电鑫龙主力资金净流出额居前。,2025-06-09 10:57
深交所：深港通下的港股通标的调入布鲁可、古茗、蜜雪集团,【深交所：深港通下的港股通标的调入布鲁可、古茗、蜜雪集团】财联社6月9日电，深交所公告，因恒生综合中型股指数实施成份股调整，根据《深圳证券交易所深港通业务实施办法》的有关规定，港股通标的证券名单发生调整，调入布鲁可、古茗、蜜雪集团，自2025年6月9日起生效。,2025-06-09 10:52
预告：商务部6月12日召开6月第2次例行新闻发布会,【预告：商务部6月12日召开6月第2次例行新闻发布会】财联社6月9日电，商务部定于2025年6月12日(星期四)下午3时举行新闻发布会，新闻发言人介绍近期商务领域重点工作有关情况，并答记者问。,2025-06-09 10:45
六大AI模型出战高考作文，人工智能ETF（159819）、科创人工智能ETF（588730）助力布局AI全产业链,"【六大AI模型出战高考作文，人工智能ETF（159819）、科创人工智能ETF（588730）助力布局AI全产业链】
截至9:36，中证人工智能主题指数上涨0.3%，上证科创板人工智能指数上涨0.2%。
2025高考进行时，DeepSeek、百度文心一言、阿里通义千问、字节跳动豆包、月之暗面Kimi、GPT4o这六个AI大语言模型充当“考生”，试写全国一卷高考作文题，在有关人士的评分下，六大AI的评分均不低于50分（满分60分），展现了大模型在语言理解与创作上的强劲实力。
中信证券表示，近期科技板块的位置已自底部抬升，整体仍处于高性价比区间，海外不确定性仍在降温，风险偏好修复带动海外市场尤其是科技板块大涨并重回年内高位，也将对A股科技成长板块形成映射。可以以AI产业链为抓手，关注上游算力自主可控与中下游应用创新。
人工智能ETF（159819）、科创人工智能ETF（588730）均覆盖AI全产业链，为投资者布局产业发展机遇提供了便捷工具，其中人工智能ETF（159819）最新规模超160亿元，居同类产品第一。",2025-06-09 10:42
我国完成超500公里公路干线通道智慧扩容,【我国完成超500公里公路干线通道智慧扩容】财联社6月9日电，记者今天（9日）从交通运输部了解到，我国公路水路交通基础设施数字化转型升级示范区域，目前已完成超过500公里公路干线通道智慧扩容。交通运输部数据显示，20个公路水路交通基础设施数字化转型升级示范区域的示范通道总里程超过6万公里，其中公路约5.4万公里、水路7500公里，基本实现国家综合立体交通网主骨架的覆盖。目前，各示范区域都在开展基于大模型的路网运行监测预警、大流量路段干线主动管控、一张网出行服务等应用场景落地，已完成超过500公里干线通道智慧扩容，构建多层级精细化交通管控模型，助推实现示范通道通行效率提升20%左右、突发事件应急响应效率提升30%左右的目标。,2025-06-09 10:41
豆包概念震荡拉升 润欣科技涨超15%,【豆包概念震荡拉升 润欣科技涨超15%】财联社6月9日电，豆包概念盘中震荡拉升，润欣科技涨超15%，光云科技、海天瑞声、引力传媒、汉仪股份等多股涨逾5%。消息面上，2025火山引擎原动力大会·春于6月11日-12日举行，本次大会聚焦大模型与AI云原生等前沿领域。包括Agent开发、多模态理解、深度思考、AI云原生等多个话题。,2025-06-09 10:40
北京：预计今年底算力供给总规模将超4.5万P 算力布局规模初显,【北京：预计今年底算力供给总规模将超4.5万P 算力布局规模初显】财联社6月9日电，记者从北京市经济和信息化局获悉，今年一季度北京市算力供给总规模超3.3万P，预计今年底算力供给总规模将超4.5万P，届时北京市算力布局规模初显，助力加快建设全球数字经济标杆城市。为贯彻落实国家关于深化人工智能研发应用决策部署，建设好算力基础设施，加快培育算力产业生态，去年北京市经济和信息化局会同市有关部门印发了《北京市算力基础设施建设实施方案（2024-2027年）》和《北京市存量数据中心优化工作方案（2024-2027年）》。北京市重点建设海淀、朝阳、亦庄、京西（门头沟、石景山）4个公共智算中心，不断优化算力布局，提升算力供给质量，提高算力调度能力。构建京津冀蒙算力一体化协同发展格局，打造京津冀蒙算力供给走廊。,2025-06-09 10:38
10点半快评：热点快速轮动 资金持续流入创新药方向,【10点半快评：热点快速轮动 资金持续流入创新药方向】市场早盘震荡反弹，创业板指领涨。成交量方面，第一个小时两市放量591亿元。板块方面，早盘市场热点快速轮动，但大多数热点均冲高回落，只有创新药板块获资金持续流入。下跌方面，黄金等周期股集体调整。,2025-06-09 10:38
星巴克中国宣布数十款产品降价 平均降幅约5元,【星巴克中国宣布数十款产品降价 平均降幅约5元】财联社6月9日电，据“星巴克中国”微信公众号消息，6月10日起，星巴克三大王牌品类——星冰乐®、冰摇茶、茶拿铁，共计数十款产品将集体推出全新夏日“心动价”。以大杯预估销量计算，平均价格降幅达到5元左右。,2025-06-09 10:36
深圳拟出台新政 支持提取公积金支付购房首付款,【深圳拟出台新政 支持提取公积金支付购房首付款】财联社6月9日电，《深圳市提振消费专项行动实施方案》近日正式发布，推出39条措施提振消费。其中在租购房方面，《方案》提出，深圳扩大住房公积金使用范围，在本市范围内购买住房符合条件的，可申请提取一次住房公积金用于支付购房首付款。记者6月9日从深圳市住房建设局了解到，公积金用于购房首付款的相关实施细则正在起草当中。此外，《方案》还提出，缴存职工本人及家庭成员在本市范围内无住房，自2025年11月1日起两年内提取住房公积金用于支付房租的，每月可提取额从申请当月应缴存额的65%提高至80%。同时，出台青年人才住房支持政策，巩固和完善“一张床、一间房、一套房”多层次租赁住房供应结构，推出更多高品质小户型保障性租赁住房。,2025-06-09 10:35
CPO概念股反复活跃 天孚通信涨近10%,【CPO概念股反复活跃 天孚通信涨近10%】财联社6月9日电，CPO概念股反复活跃，天孚通信涨近10%，迈信林、联特科技、博众精工、中际旭创涨超5%，源杰科技、太辰光、新易盛等跟涨。消息面上，中信证券指出，算力产业围绕英伟达链和ASIC链的投资机会维持高景气，看好国内PCB/CCL行业龙头有望受益于高端产能供需紧张下的产业机会，业绩增长仍具较强持续性和较高确定性。,2025-06-09 10:33
财联社6月9日电，香港恒生科技指数上涨3%至5445.13点。快手涨逾6%，美团涨5%，京东、哔哩哔哩涨超4%。,财联社6月9日电，香港恒生科技指数上涨3%至5445.13点。快手涨逾6%，美团涨5%，京东、哔哩哔哩涨超4%。,2025-06-09 10:26
体育概念股震荡拉升 中体产业、粤传媒双双涨停,【体育概念股震荡拉升 中体产业、粤传媒双双涨停】财联社6月9日电，中体产业、粤传媒双双涨停，康力源、元隆雅图、探路者、力盛体育涨超5%，金陵体育、三夫户外等跟涨。消息面上，香港立法会民政及文化体育事务委员会即将召开会议，讨论篮球博彩规管制度建议方案。,2025-06-09 10:24
