财联社6月9日电，墨西哥总统辛鲍姆称，非常可能会在七国集团峰会期间与美国总统特朗普会面。,财联社6月9日电，墨西哥总统辛鲍姆称，非常可能会在七国集团峰会期间与美国总统特朗普会面。,2025-06-09 22:30
捷强装备：公司被国家某监察委员会立案调查,【捷强装备：公司被国家某监察委员会立案调查】财联社6月9日电，捷强装备(300875.SZ)公告称，公司于今日收到国家某监察委员会《立案通知书》，对公司立案调查。公司将密切关注后续进展，及时履行信息披露义务。公司提醒广大投资者注意风险。,2025-06-09 22:21
3天2板恒宝股份：股票异常波动期间 控股股东、实际控制人存在减持公司股票的情形,【3天2板恒宝股份：股票异常波动期间 控股股东、实际控制人存在减持公司股票的情形】财联社6月9日电，恒宝股份(002104.SZ)发布异动公告，经核查，公司控股股东、实际控制人在股票交易异常波动期间存在买卖公司股票的情形。公司于2025年3月6日披露了《关于控股股东、实际控制人减持股份的预披露公告》，公司控股股东、实际控制人钱京计划减持公司股份。公司股票异常波动期间，钱京存在减持公司股票的情形，该减持行为与此前披露的减持计划一致，亦不存在违规减持的情形。,2025-06-09 22:17
财联社6月9日电，利弗莫尔证券显示，药捷安康(南京)科技股份有限公司-B通过港交所上市聆讯，联席保荐人为中信证券、华泰国际。,财联社6月9日电，利弗莫尔证券显示，药捷安康(南京)科技股份有限公司-B通过港交所上市聆讯，联席保荐人为中信证券、华泰国际。,2025-06-09 22:15
创新药概念再度大涨，关注恒生创新药ETF（159316）、港股通医药ETF（513200）等配置机会,"【创新药概念再度大涨，关注恒生创新药ETF（159316）、港股通医药ETF（513200）等配置机会】
截至收盘，恒生港股通创新药指数上涨5.2%，中证港股通医药卫生综合指数上涨4.9%，中证创新药产业指数上涨2.5%，中证生物科技主题指数上涨2.0%，沪深300医药卫生指数上涨1.3%。
渤海证券指出，展望后续，研发创新与国际化进程持续推动创新药行业蓬勃发展，产业趋势延续，高景气可期，建议关注创新药及相关产业链。",2025-06-09 22:11
北方长龙：河南众晟将成为公司控股子公司 股票复牌,【北方长龙：河南众晟将成为公司控股子公司 股票复牌】财联社6月9日电，北方长龙(301357.SZ)公告称，公司拟通过发行股份的方式购买河南众晟9.00%股权。本次交易完成后，公司与标的公司在产业链布局、技术研发、市场拓展、产品迭代、供应链整合等方面将产生互补和协同效应。一方面公司主营业务范围拓展至民用领域，另一方面，公司能够拓展复合材料装备制造的业务布局及研发生产能力。公司股票将于2025年6月10日（星期二）开市起复牌。同日公告，公司拟以现金1.02亿元（暂定价）通过受让股权及增资方式取得河南众晟51%的股权，本次交易完成后，河南众晟将成为北方长龙的控股子公司。,2025-06-09 22:05
超4100只个股上涨，A500ETF易方达（159361）、沪深300ETF易方达（510310）等助力布局核心资产,"【超4100只个股上涨，A500ETF易方达（159361）、沪深300ETF易方达（510310）等助力布局核心资产】
今日A股上行，全市场成交额超1.3万亿元，较上日放量1355亿元，超4100只个股收涨，盘面上，创新药、足球概念、可控核聚变、互联网金融板块涨幅居前，贵金属、白酒板块跌幅居前；港股全天强势，医药、科技板块大幅走强。截至收盘，中证A500指数上涨0.4%，沪深300指数上涨0.3%，创业板指数上涨1.1%，上证科创板50成份指数上涨0.6%，恒生中国企业指数上涨1.7%。",2025-06-09 22:05
我国中小企业增长强劲，关注中证1000ETF易方达（159633）、创业板200ETF易方达（159572）等产品表现,"【我国中小企业增长强劲，关注中证1000ETF易方达（159633）、创业板200ETF易方达（159572）等产品表现】
截至收盘，中证500指数上涨0.8%，中证1000指数上涨1.1%，科创100指数上涨1.1%，创业板中盘200指数上涨1.9%。
据央视报道，2025年以来，我国中小企业产销持续改善，创新活力竞相迸发，回升向好势头进一步巩固，为工业经济稳增长提供了有力支撑。最新统计显示，1-4月规模以上工业中小企业增加值同比增长8.2%，营业收入达25.8万亿元。",2025-06-09 22:05
机构认为科技仍将是中长期配置主线，关注易方达上证科创50ETF联接基金（A/C/Y: 011608/011609/022895）等动向,"【机构认为科技仍将是中长期配置主线，关注易方达上证科创50ETF联接基金（A/C/Y: 011608/011609/022895）等动向】
截至收盘，创业板指数上涨1.1%，中证科创创业50指数上涨1.0%，上证科创板50成份指数上涨0.6%。
银河证券表示，科技仍将是中长期配置主线。短期来看，一系列大会即将召开有望带动行情反弹，但在市场主线快速轮动的环境下，建议关注估值较低的细分板块。",2025-06-09 22:05
双创板块走高，创业板ETF（159915）、科创板50ETF（588080）等产品助力把握科技创新机遇,"【双创板块走高，创业板ETF（159915）、科创板50ETF（588080）等产品助力把握科技创新机遇】
截至收盘，创业板指数上涨1.1%，中证科创创业50指数上涨1.0%，上证科创板50成份指数上涨0.6%。",2025-06-09 22:05
科创板系列指数走强，科创综指ETF易方达（589800）、科创板50ETF（588080）等助力布局优质科技资产,"【科创板系列指数走强，科创综指ETF易方达（589800）、科创板50ETF（588080）等助力布局优质科技资产】
截至收盘，上证科创板成长指数上涨1.6%，科创综指上涨1.2%，科创100指数上涨1.1%，上证科创板50成份指数上涨0.6%，盘面上，创新药题材大涨，固态电池概念股表现活跃。",2025-06-09 22:05
创业板系列指数集体涨超1%，创业板200ETF易方达（159572）、创业板ETF（159915）聚焦创新型企业,"【创业板系列指数集体涨超1%，创业板200ETF易方达（159572）、创业板ETF（159915）聚焦创新型企业】
截至收盘，创业板中盘200指数上涨1.9%，创业板成长指数上涨1.5%，创业板指数上涨1.1%。",2025-06-09 22:03
机构称6月后科技成长有望占优，易方达上证科创50ETF联接基金（A/C/Y: 011608/011609/022895）等受关注,"【机构称6月后科技成长有望占优，易方达上证科创50ETF联接基金（A/C/Y: 011608/011609/022895）等受关注】
截至收盘，上证科创板成长指数上涨1.6%，科创综指上涨1.2%，科创100指数上涨1.1%，上证科创板50成份指数上涨0.6%。
兴业证券表示，进入6月份，科技成长往往会再度进入到一个相对占优的窗口，其中来自产业的催化是重要驱动。对于今年，后续的一系列科技产业重要事件同样有望提供催化。",2025-06-09 22:03
标的指数实现五连阳，信创ETF易方达（159540）连续9个交易日获资金加仓,"【标的指数实现五连阳，信创ETF易方达（159540）连续9个交易日获资金加仓】
截至收盘，上证科创板50成份指数上涨0.6%，中证芯片产业指数下跌0.1%，中证半导体材料设备主题指数上涨0.3%，国证信息技术创新主题指数上涨0.5%、实现五连阳。根据Wind数据统计，截至昨日，信创ETF易方达（159540）连续9个交易日获资金净流入，合计金额近5亿元。",2025-06-09 22:03
机构看好AI算力芯片等方向，芯片ETF易方达（516350）、机器人ETF易方达（159530）等助力布局高端制造产业,"【机构看好AI算力芯片等方向，芯片ETF易方达（516350）、机器人ETF易方达（159530）等助力布局高端制造产业】
截至收盘，中证军工指数上涨1.4%，国证机器人产业指数上涨0.9%，中证装备产业指数上涨0.8%，中证芯片产业指数下跌0.1%。
华泰证券指出，板块上可关注成交额占比回落且具备产业催化的低位科技方向。配置侧，把握赔率思维，关注科技中拥挤度相对低位的AI算力芯片、存储芯片、光纤光缆及智能驾驶等。",2025-06-09 22:03
超八成创业板个股收涨，关注易方达创业板ETF联接基金（A/C/Y:110026/004744/022907）等布局机会,"【超八成创业板个股收涨，关注易方达创业板ETF联接基金（A/C/Y:110026/004744/022907）等布局机会】
创业板今日走强，超八成个股收涨，指数方面，创业板中盘200指数上涨1.9%，创业板成长指数上涨1.5%，创业板指数上涨1.1%。",2025-06-09 22:03
财联社6月9日电，美国4月批发库存终值增长0.2%，预估为0%。,财联社6月9日电，美国4月批发库存终值增长0.2%，预估为0%。,2025-06-09 22:02
新希望：部分董事、监事及高管拟减持股份,"【新希望：部分董事、监事及高管拟减持股份】财联社6月9日电，新希望(000876.SZ)公告称，公司董事兼高级管理人员陶玉岭、监事庞允东、高级管理人员李爽计划通过集中竞价交易或大宗交易方式减持公司股份。陶玉岭拟减持不超过328,125股，占公司总股本的0.0072%；庞允东拟减持不超过18,000股，占公司总股本的0.0004%；李爽拟减持不超过225,000股，占公司总股本的0.0050%。",2025-06-09 21:57
财联社6月9日电，美国银行将Arm目标股价从135美元上调至150美元。,财联社6月9日电，美国银行将Arm目标股价从135美元上调至150美元。,2025-06-09 21:57
中国工程机械工业协会：1-5月挖掘机国内销量57501台 同比增长25.7%,【中国工程机械工业协会：1-5月挖掘机国内销量57501台 同比增长25.7%】财联社6月9日电，据中国工程机械工业协会对挖掘机主要制造企业统计，2025年5月销售各类挖掘机18202台，同比增长2.12%。其中国内销量8392台，同比下降1.48%；出口量9810台，同比增长5.42%。2025年1—5月，共销售挖掘机10.17万台，同比增长17.4%；其中国内销量57501台，同比增长25.7%；出口44215台，同比增长8.2%。,2025-06-09 21:55
财联社6月9日电，美股太空概念股冲高，AST SpaceMobile涨超10%，Redwire涨超8%，Rocket Lab涨超5%，维珍银河涨近2%。,财联社6月9日电，美股太空概念股冲高，AST SpaceMobile涨超10%，Redwire涨超8%，Rocket Lab涨超5%，维珍银河涨近2%。,2025-06-09 21:55
远达环保：控股股东将变更为中国电力 实际控制人仍为国家电投集团,【远达环保：控股股东将变更为中国电力 实际控制人仍为国家电投集团】财联社6月9日电，远达环保(600292.SH)公告称，公司拟发行股份及支付现金购买资产并募集配套资金，导致公司控股股东发生变化，预计将由国家电投集团变更为中国电力，实际控制人仍为国家电投集团。交易完成后，公司股权结构将发生显著变化，国家电投集团持股比例将大幅下降。此次交易尚需股东大会审议通过及监管机构批准。,2025-06-09 21:50
财联社6月9日晚间新闻精选,"【财联社6月9日晚间新闻精选】
1、中共中央政治局委员、国务院副总理何立峰与美方在英国伦敦开始举行中美经贸磋商机制首次会议。
2、李强主持国务院第十四次专题学习，通过多方面协同发力，着力破解科技成果转化瓶颈，切实提高转化效能，促进创新发展。
3、苏州市人工智能行业协会计划征集人工智能技术赋能苏州足球队的创新产品及解决方案，促进提升训练水平和竞技表现。
4、中办、国办印发《关于进一步保障和改善民生 着力解决群众急难愁盼的意见》，完善最低工资标准调整机制 合理提高最低工资标准；完善基本医疗保险药品目录调整机制 制定出台商业健康保险创新药品目录。
5、广康生化：氯虫苯甲酰胺产品尚未投产。中科曙光：海光信息换股吸收合并中科曙光，股票复牌。5天3板昂利康：公司在研创新药项目ALK-N001尚处于I期临床试验阶段。常山药业：公司艾本那肽注射液用于2型糖尿病的上市许可申请已获受理 能否上市及获批时间存在不确定性。合盛硅业回应谋划股权转让：从未与特变电工及其关联方就股权转让事宜进行过接触或洽谈。6连板共创草坪：国内相关足球体育赛事的举办对公司经营活动和经营业绩的影响较小。",2025-06-09 21:49
张裕Ａ：拟转让法国ETABLISSEMENTS ROULLET FRANSAC公司100%股权及不动产,【张裕Ａ：拟转让法国ETABLISSEMENTS ROULLET FRANSAC公司100%股权及不动产】财联社6月9日电，张裕Ａ(000869.SZ)公告称，公司下属的Francs Champs Participations SAS将其持有的法国ETABLISSEMENTS ROULLET FRANSAC公司100%股权作价260万欧元，公司将持有的与法国富郎多公司生产经营相关的不动产作价220万欧元，一并转让给法国ELIOR GROUP SA。,2025-06-09 21:39
菲律宾参议院正式启动对副总统莎拉·杜特尔特的弹劾程序,【菲律宾参议院正式启动对副总统莎拉·杜特尔特的弹劾程序】财联社6月9日电，经过长达5个小时的辩论，菲律宾参议长埃斯库德罗9日宣誓就任弹劾法庭审判长，启动对副总统莎拉·杜特尔特的弹劾程序。弹劾法庭将于11日召开会议。,2025-06-09 21:38
中航光电：股东计划减持不超过700万股,【中航光电：股东计划减持不超过700万股】财联社6月9日电，中航光电(002179.SZ)公告称，公司持股5%以上股东河南投资集团有限公司计划在本公告披露之日起的十五个交易日后的三个月内以集中竞价和大宗交易方式减持公司股份不超过700万股，占公司总股本的约0.33046%。,2025-06-09 21:37
日本政府储备米线下开售 上千人排队抢购,【日本政府储备米线下开售 上千人排队抢购】财联社6月9日电，日本政府为平抑米价投放的新一批储备米日前在北海道、鹿儿岛县和福冈县等地开始限量发售，多地超市门前排起千人长龙，一些消费者为买米彻夜排队。据日本媒体9日报道，北海道部分零售商当天开始发售政府储备米，排队顾客之多引发热议。在札幌市一家米店，上千人排队数小时，1000袋储备米迅速被抢购一空。这批米产于2022年，被日本媒体称为“老陈米”，每袋5公斤，售价为2150日元（约合107元人民币），约为市场零售价的一半。,2025-06-09 21:34
河南小麦大规模机收基本结束,【河南小麦大规模机收基本结束】财联社6月9日电，据河南省农业农村厅消息，截至6月9日17时，河南省已收获小麦8464万亩，约占全省种植面积的99.4%，全省大规模机收基本结束。,2025-06-09 21:33
财联社6月9日电，纳斯达克中国金龙指数开盘涨1.5%。,财联社6月9日电，纳斯达克中国金龙指数开盘涨1.5%。,2025-06-09 21:31
财联社6月9日电，现货铂金一度涨4.5%，最高报1222.35美元/盎司。,财联社6月9日电，现货铂金一度涨4.5%，最高报1222.35美元/盎司。,2025-06-09 21:30
纳指高开0.2% 比特币概念股走高,【纳指高开0.2% 比特币概念股走高】财联社6月9日电，美股三大指数集体高开，道指涨0.05%，纳指涨0.23%，标普500指数涨0.13%。华纳兄弟探索涨超8%，公司将分拆为两家媒体公司。VinFast涨近10%，公司计划今年将全球交付车辆数量至少翻一番。特斯拉跌3%，公司被多个投行下调评级。比特币站上107000美元，相关概念股走高，Circle涨超23%，Strategy涨超1%。,2025-06-09 21:30
中颖电子：致能工电将成为公司控股股东 股票复牌,【中颖电子：致能工电将成为公司控股股东 股票复牌】财联社6月9日电，中颖电子(300327.SZ)公告称，公司控股股东威朗国际、公司股东Win Channel与上海致能工业电子有限公司签署了《股份转让协议》和《表决权委托协议》。威朗国际拟通过协议转让方式向致能工电转让持有的公司3171.8万股无限售流通股，Win Channel拟转让1676.74万股，合计4848.54万股，占公司总股本的14.20%。同时，威朗国际将剩余3139.22万股股份的表决权委托给致能工电行使。若本次股份转让最终实施完成，致能工电将成为公司控股股东，公司实际控制人将变更为无实际控制人。公司股票自2025年6月10日（星期二）开市起复牌。,2025-06-09 21:28
财联社6月9日电，巴西拟提议对所有金融投资（FI）资产征收17.5%的所得税。,财联社6月9日电，巴西拟提议对所有金融投资（FI）资产征收17.5%的所得税。,2025-06-09 21:18
中科曙光：海光信息拟1160亿元换股吸收合并中科曙光 股票复牌,"【中科曙光：海光信息拟1160亿元换股吸收合并中科曙光 股票复牌】财联社6月9日电，中科曙光(603019.SH)公告称，海光信息拟换股吸收合并中科曙光，并发行A股股票募集配套资金。公司A股股票将于2025年6月10日开市起复牌。

参与本次换股的中科曙光股票为14.63亿股，若不考虑合并双方后续可能的除权除息等影响，按照换股比例1:0.5525计算，海光信息为本次换股吸收合并发行的股份数量合计为8.08亿股。吸收合并方换股价格为143.46元/股，被吸收合并方换股价格为79.26元/股。本次换股吸收合并中，海光信息拟购买资产的交易金额为换股吸收合并中科曙光的成交金额，为1159.67亿元。

本次换股吸收合并完成后，中科曙光将终止上市，海光信息将承继及承接中科曙光的全部资产、负债、业务、人员、合同及其他一切权利与义务。",2025-06-09 21:13
财联社6月9日电，美国天然气期货日内跌超3.00%，现报3.670美元/百万英热。,财联社6月9日电，美国天然气期货日内跌超3.00%，现报3.670美元/百万英热。,2025-06-09 21:13
财联社6月9日电，据印度国家证券交易所（NSE），全球基金6月9日净买入199亿卢比印度股票。,财联社6月9日电，据印度国家证券交易所（NSE），全球基金6月9日净买入199亿卢比印度股票。,2025-06-09 21:10
财联社6月9日电，焦煤期货主力合约跌超2%报765元/吨。,财联社6月9日电，焦煤期货主力合约跌超2%报765元/吨。,2025-06-09 21:09
长亮科技：能够支持包括稳定币在内的数字资产管理的系统需求,【长亮科技：能够支持包括稳定币在内的数字资产管理的系统需求】财联社6月9日电，长亮科技在互动平台表示，公司在涉及数字资产管理各环节均有技术积累与场景沉淀，能够支持包括稳定币在内的数字资产管理的系统需求。,2025-06-09 21:02
天亿马：拟购买星云开物控股权 股票停牌,【天亿马：拟购买星云开物控股权 股票停牌】财联社6月9日电，天亿马(301178.SZ)公告称，公司拟通过发行股份及支付现金方式购买星云开物全部或部分股权（取得控股权）并募集配套资金。本次交易预计构成重大资产重组。标的公司是一家智能自助设备数字化服务平台公司，专注于提供“智能物联网硬件+SaaS”系统一体化解决方案，为线下超过300万台自助设备实现“IoT物联网+SaaS云平台”管理，赋能工厂、运营商提升经营效益和管理效率。公司股票自2025年6月10日开市起停牌，预计在不超过10个交易日的时间内披露本次交易方案。,2025-06-09 21:01
财联社6月9日电，国内期货夜盘开盘涨跌不一，沪金跌0.16%，沪银涨0.77%，沪铜涨0.32%，焦煤跌0.13%，玻璃跌0.1%，原油涨近1%。,财联社6月9日电，国内期货夜盘开盘涨跌不一，沪金跌0.16%，沪银涨0.77%，沪铜涨0.32%，焦煤跌0.13%，玻璃跌0.1%，原油涨近1%。,2025-06-09 21:00
天铁科技：昌吉利宜兴工厂临时停产,"【天铁科技：昌吉利宜兴工厂临时停产】财联社6月9日电，天铁科技公告，2025年6月7日，因全资子公司昌吉利宜兴工厂生产所用蒸汽供应商的变电所遭雷电冲击,引发供应商跳停事故,导致其热电核心设备受损，短期内无法向昌吉利供应蒸汽。同时因蒸汽运输管道的接口规格参数等影响，昌吉利暂无法切换其他供应商替代供应蒸汽。目前该供应商正在全力对设备进行维修，经其技术人员现场勘查评估，修复工作预计需耗时约一个月。由于蒸汽是昌吉利在生产环节中需使用到的能源，受上述因素影响，昌吉利宜兴工厂已于2025年6月8日临时停产，根据蒸汽供应厂商的故障修复时间，预计停产时间为一个月左右。预计本次停产不会对公司经营产生重大不利影响。",2025-06-09 20:57
美国加州州长将就国民警卫队部署问题对特朗普政府提起诉讼,【美国加州州长将就国民警卫队部署问题对特朗普政府提起诉讼】财联社6月9日电，美国加州州长纽森在社交媒体上表示，将就国民警卫队部署问题对特朗普政府提起诉讼。近日，美国加利福尼亚州洛杉矶市的抗议者与部署在该地的国民警卫队人员和警察之间的冲突规模持续扩大。美国总统特朗普7日签署备忘录，向洛杉矶地区派驻2000名加州国民警卫队人员。加州州长纽森8日接受采访时表示，将就特朗普在洛杉矶部署国民警卫队一事起诉联邦政府。美国洛杉矶市长卡伦·巴斯对此表示 ，联邦政府向洛杉矶派遣国民警卫队以应对当前的抗议活动是“危险升级”，给当地民众带来恐慌。,2025-06-09 20:57
海光信息：拟以143.46元/股价格换股吸收合并中科曙光 股票复牌,"【海光信息：拟以143.46元/股价格换股吸收合并中科曙光 股票复牌】《科创板日报》9日讯，海光信息(688041.SH)公告称，公司与中科曙光筹划由公司通过向中科曙光全体A股换股股东发行A股股票的方式换股吸收合并中科曙光并发行A股股票募集配套资金。公司A股股票自2025年5月26日起停牌，并于6月10日开市起复牌。本次交易方案尚需再次审议及股东会审议批准，并获得相应批准、核准、注册或同意后方可正式实施。

小财注：公告显示，海光信息换股价格143.46元/股，中科曙光换股价格79.26元/股。本次换股吸收合并中，海光信息拟购买资产的交易金额为换股吸收合并中科曙光的成交金额（交易金额=中科曙光换股价格×中科曙光总股本），为1159.67亿元。",2025-06-09 20:56
天晟新材：目前无稳定币相关业务安排,【天晟新材：目前无稳定币相关业务安排】财联社6月9日电，天晟新材在互动平台表示，目前公司无稳定币相关业务安排。,2025-06-09 20:50
财联社6月9日电，美国银行将IBM目标价格从270美元上调至290美元。,财联社6月9日电，美国银行将IBM目标价格从270美元上调至290美元。,2025-06-09 20:49
财联社6月9日电，据报道，特朗普预计将于美东时间9日早上与内塔尼亚胡通话。,财联社6月9日电，据报道，特朗普预计将于美东时间9日早上与内塔尼亚胡通话。,2025-06-09 20:48
综艺股份：通过向吉莱微增资2.2亿元 合计取得其增资后总股本的45.28%,【综艺股份：通过向吉莱微增资2.2亿元 合计取得其增资后总股本的45.28%】财联社6月9日电，综艺股份(600770.SH)公告称，通过向江苏吉莱微电子股份有限公司增资2.2亿元，合计取得其增资后总股本的45.2807%；同时江苏吉莱微电子股份有限公司原实际控制人之一李大威同意将其直接持有的标的公司828.7109万股股份对应表决权全部委托给上市公司。交易完成后，公司合计控制江苏吉莱微电子股份有限公司表决权比例超过50%。截至本预案签署日，本次交易相关的审计、评估工作尚未完成。,2025-06-09 20:45
Strategy筹集1.12亿美元用于比特币购买 未出售任何MSTR股票,"【Strategy筹集1.12亿美元用于比特币购买 未出售任何MSTR股票】财联社6月9日电，Strategy在6月2日至6月8日期间通过其at-the-market(ATM)发行计划，成功销售了626,639股STRK优先股和432,679股STRF优先股，共筹集净资金1.122亿美元。值得注意的是，此次资金筹集完全来自优先股销售，公司未出售任何普通股(MSTR)。 截至6月8日，公司Common ATM计划仍有186.31亿美元可供发行，STRK ATM计划有206.17亿美元可供发行，STRF ATM计划有20.05亿美元可供发行。",2025-06-09 20:45
