700名美国海军陆战队士兵已抵达洛杉矶,【700名美国海军陆战队士兵已抵达洛杉矶】财联社6月10日电，美国北方司令部当地时间10日称，700名海军陆战队士兵已抵达洛杉矶地区。美军北方司令部9日发表声明说，约700名海军陆战队士兵已完成动员，他们将与已部署在加利福尼亚州洛杉矶地区的国民警卫队“无缝对接”，保护洛杉矶地区的联邦机构和人员。,2025-06-10 23:59
刘建超出席第十三届中英政党对话,【刘建超出席第十三届中英政党对话】财联社6月10日电，6月8日至10日，中共中央对外联络部部长刘建超一行在英国伦敦出席第十三届中英政党对话，其间分别同外交发展大臣拉米，工党前领袖、前首相布莱尔等会见交流。双方表示，中英同为联合国安理会常任理事国和世界主要经济体，在全球性挑战日益增多的形势下，健康稳定的中英关系符合两国和世界利益。双方要充分发挥中英政党对话等机制作用，加强沟通对话，增进相互理解与信任，拓展各领域务实合作，密切人文交流，共同维护以联合国为核心的国际秩序，促进世界和平发展。,2025-06-10 23:46
财联社6月10日电，美国总统特朗普称，伊朗在核谈判中表现得更加激进。,财联社6月10日电，美国总统特朗普称，伊朗在核谈判中表现得更加激进。,2025-06-10 23:43
胜业电气：126万股解除限售,【胜业电气：126万股解除限售】财联社6月10日电，胜业电气公告，本次股票解除限售数量为126万股，占公司总股本1.55%，可交易时间为2025年6月13日。,2025-06-10 23:41
星昊医药：2024年年度权益分派1941.57万元,【星昊医药：2024年年度权益分派1941.57万元】财联社6月10日电，星昊医药公告，2024年年度权益分派方案已获股东会审议通过，共计派发现金红利1941.57万元。权益登记日为6月17日，除权除息日为6月18日。每10股派1.6元。,2025-06-10 23:41
特瑞斯：110.44万股解除限售,"【特瑞斯：110.44万股解除限售】财联社6月10日电，特瑞斯公告，本次股票解除限售数量为1,104,350股，占公司总股本的0.8874%，可交易时间为2025年6月16日。",2025-06-10 23:41
明阳科技：拟10转3派3.883元,【明阳科技：拟10转3派3.883元】财联社6月10日电，明阳科技公告，公司2024年年度权益分派方案为以现有总股本1.03亿股为基数，每10股转增3股并派3.883元。股权登记日为2025年6月16日，除权除息日为2025年6月17日。,2025-06-10 23:41
美心翼申：实控人、董事长兼总经理徐争鸣解除留置,【美心翼申：实控人、董事长兼总经理徐争鸣解除留置】财联社6月10日电，美心翼申公告，公司实控人、董事长兼总经理徐争鸣已解除留置，恢复正常履职，公司生产经营正常。,2025-06-10 23:41
海能技术：获坩埚自动清理装置发明专利,【海能技术：获坩埚自动清理装置发明专利】财联社6月10日电，海能技术公告，公司近日获得一项发明专利，名为“坩埚自动清理装置及具有其的元素分析仪”。,2025-06-10 23:40
乐创技术：2024年年度权益分派每10股转增4股派2元,【乐创技术：2024年年度权益分派每10股转增4股派2元】财联社6月10日电，乐创技术公告，以现有总股本5066.8963万股为基数，每10股转增4股派2元。权益登记日为2025年6月19日，除权除息日为2025年6月20日。,2025-06-10 23:40
锦波生物：2024年年度权益分派每10股转增3股并派20元现金,【锦波生物：2024年年度权益分派每10股转增3股并派20元现金】财联社6月10日电，锦波生物公告，2024年年度权益分派方案已获股东会审议通过，以现有总股本8851.18万股为基数，每10股转增3股并派20元现金。权益登记日为6月17日，除权除息日为6月18日。,2025-06-10 23:40
骑士乳业：3269万股解除限售,【骑士乳业：3269万股解除限售】财联社6月10日电，骑士乳业公告，本次股票解除限售数量为3269万股，占公司总股本的15.64%，可交易时间为2025年6月13日。,2025-06-10 23:40
五新隧装：拟申请不超过3.8亿元银行授信,【五新隧装：拟申请不超过3.8亿元银行授信】财联社6月10日电，五新隧装公告，为满足生产经营需要，公司拟向银行申请总规模不超过3.8亿元的综合授信额度。,2025-06-10 23:40
长安汽车：将供应商支付账期统一至60天内,【长安汽车：将供应商支付账期统一至60天内】财联社6月10日电，长安汽车携旗下长安启源、长安凯程、深蓝汽车、阿维塔，向行业宣布，将供应商支付账期统一至60天内，以切实行动践行央企社会责任，保障中小企业资金高效流转，助力产业链良好协同运行，共同努力，推进行业高质量发展。,2025-06-10 23:38
广东与东盟签约7项目累计超31亿美元,【广东与东盟签约7项目累计超31亿美元】财联社6月10日电，2025中国（广东）-东盟贸易促进与供应链合作机制建设对接交流会10日在广州举行。现场签约7个合作项目，涉及金额超31亿美元，分布在农业、矿业、文旅等领域。,2025-06-10 23:37
欧洲主要股指收盘涨跌不一,【欧洲主要股指收盘涨跌不一】财联社6月10日电，德国DAX30指数收跌0.69%，法国CAC40指数收涨0.10%，意大利股指收跌0.47%，英国富时100指数收涨0.35%。,2025-06-10 23:34
《智能社会发展与治理标准化指引（2025版）》印发,【《智能社会发展与治理标准化指引（2025版）》印发】财联社6月10日电，中央网信办秘书局、市场监管总局办公厅近期联合印发《智能社会发展与治理标准化指引（2025版）》。《指引》旨在建立健全科学合理的智能社会发展与治理标准研究制定、实施反馈、优化完善的工作机制，建成覆盖智能技术主要社会应用场景、有效保障技术全生命周期良性健康发展的标准体系，从而适应技术创新需要、满足产业发展需求、支撑智能社会建设，助力国家治理体系和治理能力现代化。,2025-06-10 23:30
财联社6月10日电，美国国债收益率走低，10年期国债收益率最新小幅下跌至4.4758%。,财联社6月10日电，美国国债收益率走低，10年期国债收益率最新小幅下跌至4.4758%。,2025-06-10 23:28
财联社6月10日电，运河管理局称，5月通过巴拿马运河的船只平均降至每日31.4艘。,财联社6月10日电，运河管理局称，5月通过巴拿马运河的船只平均降至每日31.4艘。,2025-06-10 23:12
财联社6月10日电，Meta Platforms将支付近150亿美元，获得人工智能初创公司Scale AI 49%的股权。,财联社6月10日电，Meta Platforms将支付近150亿美元，获得人工智能初创公司Scale AI 49%的股权。,2025-06-10 23:12
吉利汽车集团：将供应商支付账期统一至60天内,【吉利汽车集团：将供应商支付账期统一至60天内】财联社6月10日电，为了积极响应落实国务院《保障中小企业款项支付条例》和中国汽车工业协会《关于维护公平竞争秩序促进行业健康发展的倡议》，吉利汽车集团宣布，将供应商支付账期统一至60天内，以加速产业链资金周转效率，保障产业链供应链稳定，发挥领军企业担当，促进汽车产业高质量发展。,2025-06-10 23:09
《推动人工智能安全可靠可控发展行业倡议》发布,【《推动人工智能安全可靠可控发展行业倡议》发布】财联社6月10日电，在安徽合肥举办的2025年中国网络文明大会网络法治分论坛上，在中央网信办网络法治局、网络管理技术局指导下，中国网络空间安全协会会同60余家会员单位发布《推动人工智能安全可靠可控发展行业倡议》。该倡议旨在响应《生成式人工智能服务管理暂行办法》《人工智能生成合成内容标识办法》等政策要求，推动行业自律，强化技术研发、应用推广和生态建设中的安全可控要求，为人工智能健康发展营造良好环境。,2025-06-10 23:08
财联社6月10日电，土耳其对可口可乐展开反垄断调查。,财联社6月10日电，土耳其对可口可乐展开反垄断调查。,2025-06-10 23:06
国信证券：公司发行股份购买资产暨关联交易事项将接受深交所审核,【国信证券：公司发行股份购买资产暨关联交易事项将接受深交所审核】财联社6月10日电，国信证券(002736.SZ)公告称，公司拟通过发行A股股份的方式购买万和证券股份有限公司96.08%股份。该交易构成关联交易，不构成重大资产重组，不构成重组上市。深圳证券交易所并购重组审核委员会拟于近期审核该事项。,2025-06-10 23:05
财联社6月10日电，墨西哥6月6日当周外汇储备2404.4亿美元。,财联社6月10日电，墨西哥6月6日当周外汇储备2404.4亿美元。,2025-06-10 23:03
Sam Altman宣布：OpenAI对o3降价80%,【Sam Altman宣布：OpenAI对o3降价80%】财联社6月10日电，OpenAI首席执行官Sam Altman在社交平台发文称，OpenAI对o3降价80%。,2025-06-10 23:02
财联社6月10日电，波音五月交付了45架飞机，其中包括31架737 MAX和7架787。,财联社6月10日电，波音五月交付了45架飞机，其中包括31架737 MAX和7架787。,2025-06-10 23:01
大商所、郑商所夜盘收盘 焦煤涨超1%,【大商所、郑商所夜盘收盘 焦煤涨超1%】财联社6月10日电，大商所、郑商所夜盘收盘，多数上涨。焦煤、焦炭等涨超1%，淀粉、菜粕等小幅上涨；PTA、PX等小幅下跌。,2025-06-10 23:00
泽连斯基签署法令对多家俄机构及组织实施制裁,【泽连斯基签署法令对多家俄机构及组织实施制裁】财联社6月10日电，乌克兰总统泽连斯基当地时间6月10日签署法令对9家俄罗斯教育及公共组织实施制裁。此外，法令还包括对俄罗斯、白俄罗斯等国的46名个人实施制裁。相关文件已在乌总统府官网公布。,2025-06-10 22:59
长江上游水库群今年累计向中下游补水380亿立方米,【长江上游水库群今年累计向中下游补水380亿立方米】财联社6月10日电，据了解，今年长江上游水库群已累计向中下游补水380亿立方米，为长江中下游地区夏粮收获提供坚实水利保障。,2025-06-10 22:57
摩根士丹利CEO：预计股权资本市场活动将逐步回暖,【摩根士丹利CEO：预计股权资本市场活动将逐步回暖】财联社6月10日电，摩根士丹利CEO表示，近期交易公告开始出现回升，预计股权资本市场活动将逐步回暖，近期交易表现良好；预计本季度将迎来强劲收尾；交易渠道稳定，并在某些地区呈现增长态势。,2025-06-10 22:48
财联社6月10日电，Circle盘中回落，现跌幅扩大至逾9%，报104.75美元/股；此前上市3日累涨超270%。,财联社6月10日电，Circle盘中回落，现跌幅扩大至逾9%，报104.75美元/股；此前上市3日累涨超270%。,2025-06-10 22:47
本轮巴以冲突以来约旦河西岸约1.75万巴勒斯坦人被捕,【本轮巴以冲突以来约旦河西岸约1.75万巴勒斯坦人被捕】财联社6月10日电，巴勒斯坦囚犯事务部门当地时间10日发布声明称，以军今年5月在约旦河西岸地区共逮捕了488名巴勒斯坦人，其中包括39名儿童和23名妇女。自2023年10月7日新一轮巴以冲突爆发以来，约旦河西岸地区已有约17500人被捕，其中包括545名妇女和约1400名儿童。,2025-06-10 22:46
市场监管总局出手 打击宣称“减肥”功能食品添加非食用物质违法行为,"【市场监管总局出手 打击宣称“减肥”功能食品添加非食用物质违法行为】财联社6月10日电，市场监管总局官网6月10日发布《市场监管总局办公厅关于打击食品中非法添加比沙可啶及其系列衍生物违法行为的通知》。

通知称，近期，市场监管总局组织湖北省市场监管部门查办宣称“减肥”功能食品非法添加非食用物质系列案，发现犯罪分子在食品中非法添加比沙可啶新型衍生物，根据办案工作需要，市场监管总局认定了执法检验方法、组织专家出具了有毒有害认定意见。

市场监管总局将《食品中比沙可啶环丙甲酰替代物的执法检验方法》《食品中非法添加比沙可啶及其系列衍生物的有毒有害专家认定意见》《食品中比沙可啶及其系列衍生物的有毒有害认定意见》发给各级市场监管部门，检验检测机构可以采用上述检验方法对涉案食品进行检验，检验结果可以作为案件定性裁量和定罪量刑的参考。认定意见作为同类案件移送司法机关的佐证材料，可供司法机关甄别有毒有害物质成分、实施定罪量刑时参考。",2025-06-10 22:45
财联社6月10日电，哥伦比亚将暂停国家财政规则。,财联社6月10日电，哥伦比亚将暂停国家财政规则。,2025-06-10 22:44
欧洲央行管委Vujcic认为可以等到9月再讨论利率行动,【欧洲央行管委Vujcic认为可以等到9月再讨论利率行动】财联社6月10日电，欧洲央行管委Boris Vujcic表示，央行应该等到至少9月再深入讨论利率行动。“我们觉得我们现在处于非常好的位置，”这位克罗地亚央行行长在接受采访时表示。“现在值得等待更多经济数据，而且在我看来，再获得一份预测，然后再决定下一步行动，希望到时贸易关系也更加明朗。”,2025-06-10 22:39
我国发布全球首个深海海山数字化智能系统,【我国发布全球首个深海海山数字化智能系统】财联社6月10日电，在2025年世界海洋日及联合国海洋大会期间，我国正式发布全球首个深海海山数字化智能系统并受到国际社会广泛关注。据中国大洋事务管理局消息，由中国大洋事务管理局联合之江实验室等单位共同研发的这一系统，是我国在深海领域发布的全球首个数字化公共科技产品。这一系统填补了人工智能技术在深海领域的应用空白，将推动深海发展进入数智化时代，助力我国在深海技术创新、空间治理领域跃居引领地位。,2025-06-10 22:37
财联社6月10日电，印度官员称，印度与美国就市场准入和数字贸易举行会谈。,财联社6月10日电，印度官员称，印度与美国就市场准入和数字贸易举行会谈。,2025-06-10 22:29
财联社6月10日电，惠誉将全球主权评级展望调整为“恶化”。,财联社6月10日电，惠誉将全球主权评级展望调整为“恶化”。,2025-06-10 22:25
俄称已完成同乌方的第二批被俘人员交换,【俄称已完成同乌方的第二批被俘人员交换】财联社6月10日电，俄罗斯国防部称，俄方已同乌方完成第二批被俘人员交换。俄乌代表团本月2日在土耳其伊斯坦布尔就和平解决俄乌冲突举行第二轮直接谈判，双方同意以“全部换全部”方式交换被俘的重伤军人以及25岁以下年轻军人。据俄罗斯国防部此前公布的消息，9日，首批25岁以下被俘俄罗斯军人已从乌克兰控制区域返回。作为交换，俄方移交了同等数量的被俘乌克兰军人。,2025-06-10 22:19
泰国榴莲出口商：榴莲价格多年来最低,【泰国榴莲出口商：榴莲价格多年来最低】财联社6月10日电，今年泰国榴莲主产区迎来了“丰产季”，榴莲产量预计比去年增长超30%。泰国榴莲出口商告诉记者，由于榴莲大批量上市，加上邻国越南榴莲产量增加，今年榴莲价格是多年来最低的。泰国榴莲贸易商特别提到，中老铁路等运输方式稳定高效，有效降低了东南亚榴莲出口的运输损耗。,2025-06-10 22:18
国家广播电视总局：5月全国卫视频道首播节目用户累计收视229.0亿户次 同比上涨17.1%,【国家广播电视总局：5月全国卫视频道首播节目用户累计收视229.0亿户次 同比上涨17.1%】财联社6月10日电，据中国视听大数据（CVB）统计，2025年5月，全国卫视频道首播节目用户累计收视229.0亿户次，较上月上涨5.2%，较去年同期上涨17.1%，观众收视规模保持进一步上涨态势。,2025-06-10 22:11
阿根廷重申对马尔维纳斯群岛主权,【阿根廷重申对马尔维纳斯群岛主权】财联社6月10日电，阿根廷外交部6月10日在官网发布公报，重申对马尔维纳斯群岛、南乔治亚岛、南桑威奇群岛及周边海域主权。,2025-06-10 21:59
财联社6月10日电，据印度国家证券交易所（NSE），全球基金6月10日净买入230亿卢比印度股票。,财联社6月10日电，据印度国家证券交易所（NSE），全球基金6月10日净买入230亿卢比印度股票。,2025-06-10 21:57
以总理：加沙被扣押人员交换谈判取得“重大进展”,【以总理：加沙被扣押人员交换谈判取得“重大进展”】财联社6月10日电，以色列总理内塔尼亚胡正在与以政府部长和安全官员就加沙地带被扣押人员交换事宜进行电话磋商。他表示，目前谈判已取得“重大进展”，现在还不能抱太大希望，但以色列一直在不懈努力。,2025-06-10 21:56
财联社6月10日电，奈飞将于2025年至2028年在西班牙投资超过10亿欧元。,财联社6月10日电，奈飞将于2025年至2028年在西班牙投资超过10亿欧元。,2025-06-10 21:54
财联社6月10日电，巴基斯坦将利息所得税率从15%提高到20%。,财联社6月10日电，巴基斯坦将利息所得税率从15%提高到20%。,2025-06-10 21:52
5月份上海CPI同比持平,【5月份上海CPI同比持平】财联社6月10日电，国家统计局上海调查总队10日发布5月份上海CPI速报。2025年5月份本市CPI同比持平。从八大类看，食品烟酒类价格下降0.6%，衣着类价格上升1.9%，居住类价格上升0.4%，生活用品及服务类价格上升1.2%，交通和通信类价格下降3.8%，教育文化和娱乐类价格上升0.5%，医疗保健类价格下降1.2%，其他用品和服务类价格上升8.4%。,2025-06-10 21:51
*ST围海：拟公开挂牌转让控股子公司上海千年90.3085%股份,【*ST围海：拟公开挂牌转让控股子公司上海千年90.3085%股份】财联社6月10日电，*ST围海(002586.SZ)公告称，公司拟通过宁波产权交易中心公开挂牌转让持有的上海千年90.3085%的股份，首次挂牌价格不低于资产评估机构的评估值，即52.16万元。公司董事会同意并提请股东大会同意并授权公司管理层在有关法律、法规范围内办理与本次公开挂牌转让标的企业股份相关的事宜。若本次交易完成，上海千年将不再纳入公司合并报表范围。本次交易不构成重大资产重组，尚需提交股东大会审议。,2025-06-10 21:51
财联社6月10日电，巴基斯坦财政部长表示，计划为工薪阶层提供所得税减免。,财联社6月10日电，巴基斯坦财政部长表示，计划为工薪阶层提供所得税减免。,2025-06-10 21:48
江南化工：拟1.7亿元收购峨边国昌51%股权,"【江南化工：拟1.7亿元收购峨边国昌51%股权】财联社6月10日电，江南化工(002226.SZ)公告称，公司拟以17,034万元现金收购四川峨边昌龙化工持有的四川省峨边国昌化工51%股权。交易完成后，峨边国昌将成为公司控股子公司。本次交易不构成重大资产重组，交易价格以坤元资产评估有限公司出具的评估报告为参考依据。峨边国昌在2024年10月31日的股东全部权益价值评估值为33,700万元。",2025-06-10 21:47
财联社6月10日电，OpenAI据悉与谷歌达成新的云服务协议以获取更多计算资源。,财联社6月10日电，OpenAI据悉与谷歌达成新的云服务协议以获取更多计算资源。,2025-06-10 21:46
财联社6月10日晚间新闻精选,"【财联社6月10日晚间新闻精选】
1、当地时间6月10日，中美经贸磋商机制首次会议进入第二天。会议从上午开始，在午餐后继续进行。
2、中办、国办印发《关于深入推进深圳综合改革试点 深化改革创新扩大开放的意见》，支持深圳深化无人驾驶航空器飞行管理制度改革创新；建立健全职务科技成果赋权、转化和考核等机制。
3、国家发改委召开科技型民营企业座谈会，就编制“十五五”规划听取民营企业意见建议，支持民营企业在推动科技创新、建设现代化产业体系等方面发挥更加积极作用。
4、市场监管总局就《直播电商监督管理办法（征求意见稿）》公开征求意见，加强对直播间运营者、直播营销人员服务机构、直播营销人员的身份认证和资质审核。
5、东风汽车集团有限公司宣布，将支付账期统一至60天内。广汽集团承诺将供应商账期严格控制在60天以内。中国一汽：将“60天付款”作为所属单位付款期限要求。
6、万科A：首次出售A股库存股2200万股 成交金额1.46亿元。众生药业：在研产品RAY1225注射液临床试验进度存在不确定性。金时科技：公司暂未开展与稳定币概念相关的业务。三连板金鹰股份：未涉及固态电池业务。7连板共创草坪：股价非理性波动特征极为显著。5连板易明医药：股份转让协议事项能否最终实施完成及实施结果尚存在不确定性。",2025-06-10 21:44
泰嘉股份：中联重科拟减持不超3%公司股份,"【泰嘉股份：中联重科拟减持不超3%公司股份】财联社6月10日电，泰嘉股份(002843.SZ)公告称，股东中联重科计划自减持股份预披露公告发布之日起15个交易日后的3个月内以集中竞价交易方式减持公司股份不超过2,517,375股（占公司总股本比例1%），以大宗交易方式减持公司股份不超过5,034,751股（占公司总股本比例2%），合计拟减持公司股份不超过7,552,126股（占公司总股本比例3%）。同时，公司董事、副总裁杨乾勋计划在公告披露之日起15个交易日后的三个月内以大宗交易和/或集中竞价交易方式合计减持公司股份不超过315,000股（占公司总股本比例0.13%）。",2025-06-10 21:42
中超控股：公司电线电缆已供货给算力数据中心,【中超控股：公司电线电缆已供货给算力数据中心】财联社6月10日电，中超控股在互动平台表示，公司电线电缆已供货给算力数据中心。,2025-06-10 21:40
新雷能：股东王红昕计划减持不超过700万股,"【新雷能：股东王红昕计划减持不超过700万股】财联社6月10日电，新雷能(300593.SZ)公告称，股东王红昕计划以集中竞价、大宗交易方式减持公司股份合计不超过700万股，占剔除公司回购专用账户中的股份数量后总股本比例1.30%，自公告披露之日起三个交易日后的三个月内进行。王红昕目前持有公司股份12,387,648股，占总股本的2.28%。减持原因为自身资金需求，减持股份来源为公司首次公开发行前已发行的股份及相应因公司权益分派时资本公积转增股本增加的股份。",2025-06-10 21:37
财联社6月10日电，肯尼亚央行将基准利率下调至9.75%，市场预期为9.50%。,财联社6月10日电，肯尼亚央行将基准利率下调至9.75%，市场预期为9.50%。,2025-06-10 21:37
美总统特朗普：加州州长和洛杉矶市长“无能”,【美总统特朗普：加州州长和洛杉矶市长“无能”】财联社6月10日电，美国总统特朗普当地时间6月10日在社交媒体上发文表示，如果他没有在过去三个晚上“派兵”到洛杉矶，这座城市“现在就会被夷为平地”，就像因州长和市长的“无能”而导致2.5万栋房屋被烧毁那样。特朗普称，现在一片混乱，而且这种情况还会持续很长时间。,2025-06-10 21:33
财联社6月10日电，世界银行将全球GDP增长预测从2.7%下调至2.3%。,财联社6月10日电，世界银行将全球GDP增长预测从2.7%下调至2.3%。,2025-06-10 21:31
纳指小幅高开 腾讯音乐涨超4%,【纳指小幅高开 腾讯音乐涨超4%】财联社6月10日电，美股三大指数开盘涨跌互现，道指跌0.04%，纳指涨0.15%，标普500指数涨0.11%。腾讯音乐涨超4%，公司拟议收购喜马拉雅控股。台积电涨超2%，5月营收同比增长39.6%。食品巨头斯马克跌超6%，Q4营收不及预期。,2025-06-10 21:30
财联社6月10日电，美国国防部长海格塞斯表示，五角大楼需要620亿美元以实现核武现代化。,财联社6月10日电，美国国防部长海格塞斯表示，五角大楼需要620亿美元以实现核武现代化。,2025-06-10 21:29
第一创业：拟发行不超过12亿元公司债券,【第一创业：拟发行不超过12亿元公司债券】财联社6月10日电，第一创业(002797.SZ)公告称，公司拟发行2025年面向专业投资者公开发行的公司债券（第三期），发行金额不超过12亿元。本期债券信用评级为AAA，无担保，募集资金将用于补充公司营运资金。,2025-06-10 21:28
